,id,headline,about,url,modified_date,published_date,primary_tag,secondary_tag
377,p51nuw,"Derby fight back to deny Leeds' EPL dream, set up Aston Villa showdown",Derby County moved a step closer to the Premier League after reaching the Championship play-off final with a 4-2 win over Leeds United.,https://theage.com.au//sport/soccer/derby-fight-back-to-deny-leeds-epl-dream-set-up-aston-villa-showdown-20190516-p51nuw.html,2019-05-15T22:17:23Z,2019-05-15T22:17:23Z,EPL,[]
378,p51ngk,Jedinak's Aston Villa through to playoff final,Former Socceroos skipper Mile Jedinak scored with his only kick in the game as Aston Villa reached the League Championship final by beating West Bromwich Albion in a penalty shootout.,https://theage.com.au//sport/soccer/jedinak-s-aston-villa-through-to-playoff-final-20190515-p51ngk.html,2019-05-14T23:40:28Z,2019-05-14T23:40:28Z,EPL,[]
379,p51myc,Guardiola's addiction to winning is what drives on his players,"Remember when Pep Guardiola's appointment was a mission statement, a big idea, a sovereign wealth project to give Manchester City an identity beyond mere financial might? Well, he has delivered on it.",https://theage.com.au//sport/soccer/guardiola-s-addiction-to-winning-is-what-drives-on-his-players-20190513-p51myc.html,2019-05-13T10:02:48Z,2019-05-13T10:02:39Z,EPL,"['Manchester City', 'Liverpool FC']"
380,p51mn7,"Reality bites: City, Liverpool leave the pack chasing shadows","Liverpool may have fallen agonisingly short in their epic Premier League title quest, but they and the champions proved light years ahead of the rest.",https://theage.com.au//sport/soccer/reality-bites-city-liverpool-leave-the-pack-chasing-shadows-20190513-p51mn7.html,2019-05-13T03:41:17Z,2019-05-13T03:41:17Z,EPL,"['Liverpool FC', 'Manchester City']"
381,p51mn5,How the season unfolded: Key moments of the 2018-19 EPL title race,"It was an extraordinary Premier League season, hailed by some as the best ever, as Liverpool and Manchester City went down the wire in their title fight.",https://theage.com.au//sport/soccer/how-the-season-unfolded-key-moments-of-the-2018-19-epl-title-race-20190513-p51mn5.html,2019-05-12T22:08:36Z,2019-05-12T22:08:36Z,EPL,"['Manchester City', 'Liverpool FC']"
382,p51mmb,Manchester City break Liverpool hearts to retain Premier League title,"Liverpool did all they could with a 2-0 win over Wolves at Anfield, but it wasn't enough as the City goals rolled in at Brighton.",https://theage.com.au//sport/soccer/manchester-city-claim-premier-league-title-with-easy-brighton-win-20190513-p51mmb.html,2019-05-12T23:16:26Z,2019-05-12T16:01:07Z,EPL,"['Manchester City', 'Liverpool FC']"
383,p51mft,Huddersfield coach coy on Socceroo Mooy's future,Jan Siewert refuses to speculate on the future of Socceroos midfielder Aaron Mooy until Huddersfield have played their last Premier League game on Monday.,https://theage.com.au//sport/soccer/huddersfield-coach-coy-on-socceroo-mooy-s-future-20190512-p51mft.html,2019-05-12T02:22:01Z,2019-05-12T02:22:01Z,EPL,[]
384,p51mfv,"Leeds, Aston Villa win opening matches in Premier League bid",Two of England's most famous clubs will take one-goal leads into the second leg of their Championship play-off matches.,https://theage.com.au//sport/soccer/leeds-aston-villa-win-opening-matches-in-premier-league-bid-20190512-p51mfv.html,2019-05-11T23:26:26Z,2019-05-11T23:26:26Z,EPL,['The Championships']
385,p51mc0,This is the greatest EPL title race of all time,"Whoever wins on Monday, Manchester City and Liverpool have served up a season to savour.",https://theage.com.au//sport/soccer/this-is-the-greatest-epl-title-race-of-all-time-20190511-p51mc0.html,2019-05-11T14:17:40Z,2019-05-11T05:37:08Z,EPL,"['Manchester City', 'Liverpool FC', 'Analysis']"
386,p51lxd,Ryan's huge test could decide the Premier League title battle,Socceroos goalkeeper Mat Ryan has the chance to become a hero on the red side of Merseyside by thwarting Manchester City's march towards Premier League glory.,https://theage.com.au//sport/soccer/ryan-s-huge-test-could-decide-the-premier-league-title-battle-20190510-p51lxd.html,2019-05-10T00:12:39Z,2019-05-10T00:12:39Z,EPL,['Socceroos']
387,p51lif,Chelsea to take transfer ban fight to Court of Arbitration for Sport,Chelsea will head to the Court of Arbitration for Sport after FIFA upheld a one-year transfer ban.,https://theage.com.au//sport/soccer/chelsea-to-take-transfer-ban-fight-to-court-of-arbitration-for-sport-20190509-p51lif.html,2019-05-09T02:26:42Z,2019-05-08T22:06:33Z,EPL,"['FIFA', 'Chelsea FC']"
388,p51kxu,Premier League clubs targeting Socceroos star Tom Rogic,English Premier League clubs Southampton and Leicester City are preparing to lure Socceroos midfield ace Tom Rogic from Scottish champions Celtic.,https://theage.com.au//sport/soccer/premier-league-clubs-targeting-socceroos-star-tom-rogic-20190507-p51kxu.html,2019-05-07T12:52:55Z,2019-05-07T12:00:00Z,Socceroos,"['EPL', 'A-League']"
389,p51ktf,Manchester United's asking price may hold up potential Pogba move to Real,Paul Pogba is ready to push for a transfer to Real Madrid at the end of the season - but his hopes of a move are likely to hinge on Manchester United dramatically lowering their £160 million ($A299.7 million) valuation.,https://theage.com.au//sport/soccer/manchester-united-s-asking-price-may-hold-up-potential-pogba-move-to-real-20190507-p51ktf.html,2019-05-07T01:33:49Z,2019-05-07T01:33:49Z,EPL,['Manchester United']
390,p51kq7,Kompany strike leaves Manchester City one win from EPL title,"City fans had to wait longer for a home goal than any other match this season, but in the end their skipper dragged them within sight of defending their title.",https://theage.com.au//sport/soccer/kompany-strike-leaves-manchester-city-one-win-from-epl-title-20190507-p51kq7.html,2019-11-11T04:31:07Z,2019-05-06T21:46:21Z,EPL,"['Manchester City', 'Liverpool FC']"
391,p51kkg,"Reds praying for a miracle in title race, says Henderson",Liverpool will be crossing every finger and toe when Manchester City take on Leicester City on Tuesday morning.,https://theage.com.au//sport/soccer/reds-praying-for-a-miracle-in-title-race-says-henderson-20190506-p51kkg.html,2019-05-06T05:05:08Z,2019-05-06T05:05:08Z,Liverpool FC,"['EPL', 'Manchester City', 'Barcelona FC']"
392,p51kch,"Manchester United out of top four, Chelsea go third with Watford win","Huddersfield Town hold on for a draw, dashing Manchester United's Champions League hopes as Chelsea consolidate third.",https://theage.com.au//sport/soccer/chelsea-boost-top-four-premier-league-chances-with-3-0-watford-win-20190506-p51kch.html,2019-05-05T23:10:40Z,2019-05-05T15:19:48Z,EPL,"['Chelsea FC', 'Manchester United']"
393,p51k62,"Late winner keeps Liverpool alive, nine-man Spurs slump at Bournemouth","They left it late, but Liverpool continue to put pressure on Manchester City in the title race after coming from behind to beat Newcastle United.",https://theage.com.au//sport/soccer/late-winner-keeps-liverpool-alive-nine-man-spurs-slump-at-bournemouth-20190505-p51k62.html,2019-05-05T00:03:21Z,2019-05-04T21:28:08Z,EPL,"['Liverpool FC', 'Manchester City', 'Tottenham Hotspur']"
394,p51iah,Top four aspirants way off title challenge ... and falling further,"Liverpool and Manchester City have become Real Madrid and Barcelona, two powerhouses out in front of an increasingly incompetent chasing pack.",https://theage.com.au//sport/soccer/top-four-aspirants-way-off-title-challenge-and-falling-further-20190429-p51iah.html,2019-04-29T05:27:37Z,2019-04-29T05:21:54Z,EPL,['Analysis']
395,p51i5u,Hope continues to toy with the Anfield faithful,"Such is the fatalism on The Kop, there has been a debate over recent days as to what is more painful: the instant slaying of a title dream or or a tortuous strangulation.",https://theage.com.au//sport/soccer/hope-continues-to-toy-with-the-anfield-faithful-20190429-p51i5u.html,2019-04-29T01:09:16Z,2019-04-29T00:55:08Z,EPL,['Liverpool FC']
396,p51i55,Chaos breaks out after controversial Leeds goal against Aston Villa,Leeds missed out on automatic promotion to the EPL as their coach insisted fair play was more important than victory in a crazy match against Aston Villa.,https://theage.com.au//sport/soccer/chaos-breaks-out-after-controversial-leeds-goal-against-aston-villa-20190429-p51i55.html,2019-04-29T04:29:17Z,2019-04-29T00:40:23Z,EPL,[]
397,p51i3y,Liverpool's van Dijk voted best in EPL,Liverpool's Virgil van Dijk has been named the Professional Footballers' Association's Players' Player of the Year for 2019.,https://theage.com.au//sport/soccer/liverpool-s-van-dijk-voted-best-in-epl-20190429-p51i3y.html,2019-04-28T23:01:30Z,2019-04-28T23:01:30Z,EPL,['Liverpool FC']
398,p51i2d,"Manchester City edge closer to title, De Gea gifts Chelsea an Old Trafford draw",Manchester City took another big step towards banking back-to-back English Premier League titles as they scrapped to a 1-0 win at Burnley.,https://theage.com.au//sport/soccer/manchester-city-edge-closer-to-premier-league-title-with-burnley-win-20190429-p51i2d.html,2019-04-28T18:15:37Z,2019-04-28T15:34:02Z,EPL,"['Manchester City', 'Arsenal FC']"
399,p51hwv,"Tottenham lose, Southampton safe in EPL",Tottenham Hotspur still have work to do to secure a top-four spot in the English Premier League after they suffered a surprise 1-0 defeat at home to West Ham.,https://theage.com.au//sport/soccer/tottenham-lose-southampton-safe-in-epl-20190428-p51hwv.html,2019-04-28T02:02:18Z,2019-04-28T02:02:18Z,EPL,[]
400,p51hqy,Liverpool back on top - for now - after putting five past Huddersfield,Liverpool put the pressure back on Manchester City in the race for the Premier League title after they thumped bottom side Huddersfield.,https://theage.com.au//sport/soccer/liverpool-back-on-top-for-now-after-putting-five-past-huddersfield-20190427-p51hqy.html,2019-04-26T23:34:17Z,2019-04-26T23:34:17Z,EPL,[]
401,p51h0v,"City back on top after prevailing in Manchester derby, Arsenal stumble",Manchester City kept the destination of the EPL title in their own hands by beating Manchester United to climb back above Liverpool with three games left.,https://theage.com.au//sport/city-back-on-top-after-prevailing-in-manchester-derby-arsenal-stumble-20190425-p51h0v.html,2019-04-24T22:06:42Z,2019-04-24T21:30:26Z,EPL,[]
402,p51gou,"Southampton score fastest EPL goal but concede in 90th minute, Spurs win",Shane Long wrote his name in the record books when he lobbed the ball calmly over goalkeeper Ben Foster just 7 seconds into the match.,https://theage.com.au//sport/soccer/southampton-score-fastest-epl-goal-but-concede-in-90th-minute-spurs-win-20190424-p51gou.html,2019-04-23T22:49:42Z,2019-04-23T22:49:42Z,EPL,[]
403,p51gfn,"Man United's performance at Everton was 'disrespectful,' says Pogba","Manchester United's players did not respect the club or their fans during Sunday's 4-0 loss at Everton in the Premier League, midfielder Paul Pogba said.",https://theage.com.au//sport/soccer/man-united-s-performance-at-everton-was-disrespectful-says-pogba-20190423-p51gfn.html,2019-04-23T03:47:33Z,2019-04-23T03:47:33Z,EPL,['Manchester United']
404,p51gc8,"Chelsea held by Burnley, denting Champions League hopes","Chelsea have suffered a setback in their push for a Champions League spot, held to a 2-2 draw at home to Burnley in the Premier League.",https://theage.com.au//sport/soccer/chelsea-held-by-burnley-denting-champions-league-hopes-20190423-p51gc8.html,2019-04-22T22:58:35Z,2019-04-22T22:58:35Z,EPL,['UEFA Champions League']
405,p51g0y,"Liverpool back on top, Everton beat Manchester United in 4-0 drubbing","The honeymoon is over for Ole Gunnar Solskjaer, whose Manchester United side suffered a dreadful loss to Everton. Liverpool, meanwhile, reclaimed top spot on the table.",https://theage.com.au//sport/soccer/everton-hand-woeful-manchester-united-a-4-0-premier-league-drubbing-20190422-p51g0y.html,2019-04-21T17:26:07Z,2019-04-21T15:45:40Z,EPL,['Manchester United']
406,p51fx4,"Man City return to the top, Newcastle near safety",Manchester City have exacted a bit of revenge on Tottenham Hotspur and returned to the top of the English Premier League.,https://theage.com.au//sport/soccer/man-city-return-top-newcastle-near-safety-20190421-p51fx4.html,2019-04-21T00:46:39Z,2019-04-21T00:45:00Z,EPL,[]
407,p51fkv,'Enough': Premier League stars back anti-racism social media boycott,Leading English Premier League stars have backed a 24-hour social media boycott in protest at an escalation of incidents of racial abuse online.,https://theage.com.au//sport/soccer/enough-premier-league-stars-back-anti-racism-social-media-boycott-20190419-p51fkv.html,2019-04-18T22:47:22Z,2019-04-18T22:47:22Z,Racism,['EPL']
408,p51ex4,Ryan's Brighton sucked into Premier League relegation scrap,Socceroos goalkeeper Mat Ryan's Brighton & Hove Albion have been dragged into the Premier League's relegation dogfight after a 2-0 home loss to Cardiff City.,https://theage.com.au//sport/soccer/ryan-s-brighton-sucked-into-premier-league-relegation-scrap-20190417-p51ex4.html,2019-04-17T00:27:20Z,2019-04-17T00:27:20Z,EPL,[]
409,p51eig,Freak goal gives Arsenal win at Watford,Arsenal have capitalised on a goalkeeping gaffe from Watford's Ben Foster and a Troy Deeney red card to win 1-0 and move back into the Premier League's top four.,https://theage.com.au//sport/soccer/freak-goal-gives-arsenal-win-at-watford-20190416-p51eig.html,2019-04-15T22:58:23Z,2019-04-15T22:58:23Z,EPL,[]
410,p51e4y,"Premier League goes to the wire as Manchester City, Liverpool post wins",A spectacular strike from Mohamed Salah helped Liverpool maintain their two-point lead over Manchester City in the Premier League title race.,https://theage.com.au//sport/soccer/sterling-stars-for-manchester-city-in-easy-crystal-palace-win-20190415-p51e4y.html,2019-04-14T17:57:08Z,2019-04-14T15:22:26Z,EPL,['Manchester City']
411,p51e09,"Spurs go third, Cardiff near relegation",Lucas Moura has scored a hat-trick as Tottenham Hotspur moved back into third place in the English Premier League thanks to a 4-0 home win over relegated bottom side Huddersfield.,https://theage.com.au//sport/soccer/spurs-go-third-cardiff-near-relegation-20190414-p51e09.html,2019-04-14T02:51:36Z,2019-04-14T02:51:36Z,EPL,[]
412,p51c8f,Hazard serves up goal of the season contender as Chelsea beat West Ham,Eden Hazard's stunning individual performance earned Chelsea a 2-0 win over West Ham United which hoisted them into third spot in the Premier League.,https://theage.com.au//sport/soccer/hazard-serves-up-goal-of-the-season-contender-as-chelsea-beat-west-ham-20190409-p51c8f.html,2019-04-08T22:33:33Z,2019-04-08T22:33:33Z,EPL,[]
413,p51bts,Everton dent Arsenal's hopes with 1-0 win in heated game at Goodison,Everton's Phil Jagielka took advantage of a late recall to score the only goal of the game against Arsenal at Goodison Park.,https://theage.com.au//sport/soccer/everton-dent-arsenal-s-hopes-with-1-0-win-in-heated-game-at-goodison-20190408-p51bts.html,2019-04-07T16:15:36Z,2019-04-07T16:12:37Z,EPL,['Arsenal FC']
414,p51bo4,Aaron Mooy makes young fan's dream a reality,Socceroos star Aaron Mooy has made a young fan's dream come true and scored in Huddersfield Town's Premier League loss to Leicester City within the space of 24 hours.,https://theage.com.au//sport/soccer/aaron-mooy-makes-young-fan-s-dream-a-reality-20190407-p51bo4.html,2019-04-07T01:45:59Z,2019-04-07T01:45:59Z,EPL,[]
415,p51bnr,Ryan's Brighton sunk in FA Cup semi-final,Socceroos No.1 Mat Ryan has missed the chance to become just the sixth Australian to play in the FA Cup final as his Brighton side lost 1-0 to Manchester City in Saturday's semi-final at Wembley.,https://theage.com.au//sport/soccer/ryan-s-brighton-sunk-in-fa-cup-semi-final-20190407-p51bnr.html,2019-04-07T01:29:25Z,2019-04-07T01:29:25Z,FA Cup,['EPL']
416,p51bgg,Salah breaks drought as Liverpool leave it late to reclaim top spot,Late goals by Mohamed Salah and Jordan Henderson earned Liverpool a crucial 3-1 victory at Southampton to move them back to the top of the Premier League on Friday.,https://theage.com.au//sport/salah-breaks-drought-as-liverpool-leave-it-late-to-reclaim-top-spot-20190406-p51bgg.html,2019-04-05T22:12:55Z,2019-04-05T22:03:06Z,EPL,[]
417,p51b5j,Socceroo Ryan chasing FA Cup final glory,Brighton keeper Mat Ryan is just one win away from becoming the sixth Australian to play in the storied English showpiece. But the Seagulls will have to stop Manchester City to get there.,https://theage.com.au//sport/soccer/socceroo-ryan-chasing-fa-cup-final-glory-20190405-p51b5j.html,2019-04-05T00:23:57Z,2019-04-05T00:23:57Z,FA Cup,"['Socceroos', 'EPL']"
418,p51ama,Manchester City back on top with win over Cardiff,Manchester City have beaten Cardiff City 2-0 to move a point clear of Liverpool at the top of the English Premier League with six games remaining.,https://theage.com.au//sport/soccer/manchester-city-back-on-top-with-win-over-cardiff-20190404-p51ama.html,2019-04-03T21:22:47Z,2019-04-03T21:22:35Z,EPL,['Manchester City']
419,p51a6y,"United's top-four hopes dealt a blow in EPL, Fulham relegated",Fulham have become the second side relegated this season while Manchester United's hopes of finishing at the pointy end of the Premier League took a hit.,https://theage.com.au//sport/soccer/united-s-top-four-hopes-dealt-a-blow-in-epl-fulham-relegated-20190403-p51a6y.html,2019-04-02T22:00:41Z,2019-04-02T21:30:09Z,EPL,['Manchester United']
420,p51a6o,Mourinho reopens war of words with 'His Excellency' Pogba,Sacked Manchester United boss Jose Mourinho says he would have been 'sent on vacation' if he had upset record club signing Paul Pogba.,https://theage.com.au//sport/soccer/mourinho-reopens-war-of-words-with-his-excellency-pogba-20190403-p51a6o.html,2019-04-02T20:46:34Z,2019-04-02T20:46:34Z,EPL,['Manchester United']
421,p519wc,Everton probe alleged Pickford incident,Everton say they are investigating after video footage allegedly showing England goalkeeper Jordan Pickford involved in a street fight was widely shared online.,https://theage.com.au//sport/soccer/everton-probe-alleged-pickford-incident-20190402-p519wc.html,2019-04-02T00:22:30Z,2019-04-02T00:22:30Z,EPL,[]
422,p519tw,Arsenal beat Newcastle to go third in EPL,Arsenal have moved above bitter rivals Spurs into third in the Premier League following a 2-0 home win over Newcastle at the Emirates.,https://theage.com.au//sport/soccer/arsenal-beat-newcastle-to-go-third-in-epl-20190402-p519tw.html,2019-04-01T21:21:14Z,2019-04-01T21:21:14Z,EPL,['Arsenal FC']
423,p519iq,Lloris clanger gives Liverpool late title lifeline,Liverpool have snatched a last-gasp winner as they beat Tottenham 2-1 to give themselves a massive boost in their hopes of a first English Premier League title since 1990.,https://theage.com.au//sport/soccer/lloris-clanger-gives-liverpool-late-title-lifeline-20190401-p519iq.html,2019-04-01T01:52:33Z,2019-03-31T22:35:15Z,EPL,"['Liverpool FC', 'Tottenham Hotspur']"
424,p519gu,"Own goal gifts Liverpool win over Spurs, Chelsea stage late comeback",Late goals rescued both Liverpool and Chelsea in the Premier League on Sunday.,https://theage.com.au//sport/soccer/chelsea-stage-thrilling-premier-league-comeback-to-win-away-at-cardiff-20190401-p519gu.html,2019-03-31T17:44:39Z,2019-03-31T16:58:03Z,EPL,['Chelsea FC']
425,p519c3,"Man City back on top, Huddersfield go down","Manchester City have returned with a swagger from the international break, resuming their quest for four trophies with another dominant 2-0 win at Fulham.",https://theage.com.au//sport/soccer/man-city-back-on-top-huddersfield-go-down-20190331-p519c3.html,2019-03-31T01:12:21Z,2019-03-31T01:12:21Z,EPL,[]
426,p518pr,Red Devils reward Solskjaer for his rescue act with permanent job,The move has seemed inevitable for many weeks given the transformation United have made since Ole Gunnar Solskjaer arrived at Old Trafford  on a caretaker basis,https://theage.com.au//sport/soccer/red-devils-reward-solskjaer-for-his-rescue-act-with-permanent-job-20190328-p518pr.html,2019-03-28T09:56:13Z,2019-03-28T09:50:46Z,EPL,['Manchester United']
427,p518cw,Harry Kane eyes career in the NFL to become 'greatest sportsman ever',Harry Kane has revealed he wants to try to make it in the NFL once his soccer career comes to an end and become one of the greatest sportsmen of all time.,https://theage.com.au//sport/nfl/harry-kane-eyes-career-in-the-nfl-to-become-greatest-sportsman-ever-20190328-p518cw.html,2019-03-27T22:05:41Z,2019-03-28T00:00:00Z,EPL,['England']
428,p518cn,Unwanted Premier League record looms for Mooy's Huddersfield,Socceroos midfielder Aaron Mooy's Huddersfield could reach a new low in their woeful English Premier League season if another loss combines with results elsewhere.,https://theage.com.au//sport/soccer/unwanted-premier-league-record-looms-for-mooy-s-huddersfield-20190328-p518cn.html,2019-03-27T21:44:08Z,2019-03-27T21:44:08Z,EPL,[]
429,p514zt,"Liverpool beat Fulham to go top, Everton sink Chelsea",Livewire Sadio Mané scored one goal and played a crucial part in a second as Liverpool reclaimed the Premier League's top spot at Craven Cottage on Sunday.,https://theage.com.au//sport/soccer/liverpool-beat-fulham-to-go-top-of-the-premier-league-20190318-p514zt.html,2019-03-17T20:41:55Z,2019-03-17T16:36:22Z,EPL,['Liverpool FC']
430,p514vr,"Beckham backs Solskjaer, says fans want him to continue",David Beckham has hailed Manchester United caretaker manager Ole Gunnar Solskjaer for his transformation of the club.,https://theage.com.au//sport/soccer/beckham-backs-solskjaer-says-fans-want-him-to-continue-20190317-p514vr.html,2019-03-17T00:27:36Z,2019-03-17T00:27:36Z,EPL,['Manchester United']
431,p514vb,"Burnley in peril, Newcastle grab late draw",Burnley suffered a hammer blow to their Premier League survival hopes as Wes Morgan scored a 90th-minute winner for 10-man Leicester City at Turf Moor.,https://theage.com.au//sport/soccer/burnley-in-peril-newcastle-grab-late-draw-20190317-p514vb.html,2019-03-16T23:23:09Z,2019-03-16T23:23:09Z,EPL,[]
432,p514sx,United urged to write their own chapter against Barcelona,Ole Gunnar Solskjaer has told his Manchester United players to ignore the talk and write their own history in Barcelona.,https://theage.com.au//sport/soccer/united-urged-to-write-their-own-chapter-against-barcelona-20190316-p514sx.html,2019-03-16T06:24:23Z,2019-03-16T06:23:27Z,EPL,['Manchester United']
433,p5136g,"Firmino and Mane fire Liverpool to victory, United taste defeat","Jurgen Klopp's side move to 73 points, one behind City, while Manchester United and Chelsea both dropped points.",https://theage.com.au//sport/soccer/firmino-and-mane-fire-liverpool-to-victory-over-burnley-20190311-p5136g.html,2019-03-10T21:55:35Z,2019-03-10T15:11:55Z,EPL,"['Liverpool FC', 'Chelsea FC', 'Manchester City', 'Manchester United']"
434,p51321,"Sterling Manchester City surge clear, Spurs sunk",Raheem Sterling’s hat-trick in Manchester City’s 3-1 win over Watford lifted the champions four points clear at the top of the EPL.,https://theage.com.au//sport/soccer/sterling-manchester-city-surge-clear-spurs-sunk-20190310-p51321.html,2019-03-10T00:08:39Z,2019-03-10T00:08:39Z,EPL,[]
435,p512tx,Melbourne City owners under investigation from UEFA,"The vice-chairman of Melbourne City may be drawn into a UEFA investigation into the A-League team's parent club, Manchester City.",https://theage.com.au//sport/soccer/melbourne-city-owners-under-investigation-from-uefa-20190308-p512tx.html,2019-03-08T13:11:43Z,2019-03-08T07:19:36Z,Melbourne City,"['Manchester City', 'EPL']"
436,p511s4,"Finally, a genuine EPL title race: so where will it be won and lost?",The bar has been set so high this season that neither Liverpool nor Manchester City should be branded a failure when one of them ultimately falls short.,https://theage.com.au//sport/soccer/finally-a-genuine-epl-title-race-so-where-will-it-be-won-and-lost-20190305-p511s4.html,2019-03-05T00:05:46Z,2019-03-05T00:05:18Z,EPL,"['Liverpool FC', 'Manchester City']"
437,p511iz,Toothless Liverpool frustrated by Everton to stay second,"Merseyside rivals Everton were happy with their efforts in holding title-chasing Liverpool, while Brendan Rodgers tasted defeat in his first match with the Foxes.",https://theage.com.au//sport/soccer/toothless-liverpool-frustrated-by-everton-to-stay-second-20190304-p511iz.html,2019-03-03T20:31:01Z,2019-03-03T20:31:01Z,EPL,"['Liverpool FC', 'Manchester City']"
438,p511eq,"Injury-hit City back on top, Arsenal and Spurs play out dramatic draw",Manchester City picked up injuries to two key players and an important three points in overnight EPL action as the Red Devils cracked the top four.,https://theage.com.au//sport/soccer/chelsea-bounce-back-in-epl-after-cup-woe-20190303-p511eq.html,2019-03-02T20:16:35Z,2019-03-02T20:11:53Z,EPL,"['Manchester City', 'Liverpool FC', 'Arsenal FC', 'Tottenham Hotspur']"
439,p5114f,"Fan pressure hurt Liverpool before, and City can reel them in: Sterling","Former Liverpool forward Raheem Sterling says fan pressure affected the players in their EPL title charge in 2014, but things are different at Manchester City.",https://theage.com.au//sport/soccer/fan-pressure-hurt-liverpool-before-and-city-can-reel-them-in-sterling-20190301-p5114f.html,2019-03-01T00:57:42Z,2019-03-01T00:57:42Z,EPL,"['Manchester City', 'Liverpool FC']"
440,p510iy,"Newcastle edge clear of danger, Rodgers watches Leicester end slump",Socceroos Mat Ryan and Aaron Mooy enjoyed contrasting fortunes as the Premier League's bottom clubs fought for survival.,https://theage.com.au//sport/soccer/newcastle-edge-clear-of-danger-rodgers-watches-leicester-end-slump-20190227-p510iy.html,2019-02-27T00:08:09Z,2019-02-27T00:08:09Z,EPL,[]
