,id,headline,about,url,modified_date,published_date,primary_tag,secondary_tag
505,p50ovr,We must beat Liverpool to stay in title race: Guardiola,Manchester City boss Pep Guardiola has declared the fight for the Premier League title will be over if his side loses to the Reds on Friday.,https://theage.com.au//sport/soccer/we-must-beat-liverpool-to-stay-in-title-race-guardiola-20181231-p50ovr.html,2018-12-30T22:37:01Z,2018-12-30T22:37:01Z,EPL,"['Liverpool FC', 'Manchester City']"
506,p50ovg,"Chelsea win at Crystal Palace, Man City bounce back against Saints",Chelsea maintained their pursuit of the Premier League's top three clubs with a 1-0 win away to London rivals Crystal Palace on Sunday.,https://theage.com.au//sport/soccer/kante-strike-gives-chelsea-1-0-win-at-crystal-palace-20181231-p50ovg.html,2018-12-30T20:34:25Z,2018-12-30T14:39:16Z,EPL,['Chelsea FC']
507,p50osd,Liverpool thrash Arsenal 5-1 to extend EPL lead,"Jurgen Klopp's side made another statement of its title intentions at Anfield, while Tottenham's hopes were rocked by a surprise defeat.",https://theage.com.au//sport/soccer/liverpool-thrash-arsenal-5-1-to-extend-epl-lead-20181230-p50osd.html,2018-12-30T01:06:30Z,2018-12-29T20:04:26Z,EPL,"['Liverpool FC', 'Manchester City', 'Arsenal FC']"
508,p50oiz,Liverpool defence standing tall ahead of Arsenal test,"Well-placed for a tilt at ending their long title drought, Liverpool face another stern test when they host Arsenal this weekend.",https://theage.com.au//sport/liverpool-defence-standing-tall-ahead-of-arsenal-test-20181228-p50oiz.html,2018-12-27T23:02:30Z,2018-12-27T23:02:30Z,EPL,"['Liverpool FC', 'Arsenal FC', 'Manchester City']"
509,p50ojm,Anderson double gives West Ham entertaining EPL win,West Ham have moved into the top half of the table following their come-from-behind win over an in-form Southampton.,https://theage.com.au//sport/soccer/anderson-double-gives-west-ham-entertaining-epl-win-20181228-p50ojm.html,2018-12-27T22:30:53Z,2018-12-27T22:30:53Z,EPL,[]
510,p50ocp,"Liverpool make the most of City's stumble, Spurs into second",Liverpool have taken advantage of another surprise slip-up from champions Manchester City to open up a six-point lead at the top of the English Premier League.,https://theage.com.au//sport/soccer/liverpool-make-the-most-of-city-s-stumble-spurs-into-second-20181227-p50ocp.html,2018-12-27T03:58:52Z,2018-12-26T20:23:49Z,EPL,['Liverpool FC']
511,p50o5w,Too soon: Mooy ruled out of Australia's Asian Cup defence,Aaron Mooy sought a second opinion on his injured knee in a desperate effort to play a part in the continental competition.,https://theage.com.au//sport/soccer/mooy-ruled-out-of-australia-s-asian-cup-defence-20181225-p50o5w.html,2018-12-24T21:02:08Z,2018-12-24T20:54:23Z,Asian Cup,"['Socceroos', 'EPL']"
512,p50o2y,Van Dijk puts Liverpool top of the tree without a wobble,Even with this record-breaking team there is a fear Jurgen Klopp is navigating the first team in history towards 90 points and finishing runners-up.,https://theage.com.au//sport/soccer/van-dijk-puts-liverpool-top-of-the-tree-without-a-wobble-20181224-p50o2y.html,2018-12-25T01:56:22Z,2018-12-24T01:40:43Z,EPL,['Liverpool FC']
513,p50o19,Tottenham's big win gives Pochettino a chance to show romantic side,Tottenham boss Mauricio Pochettino is an old romantic at heart.,https://theage.com.au//sport/soccer/rampant-tottenham-belt-everton-6-2-close-gap-on-manchester-city-20181224-p50o19.html,2018-12-23T23:19:57Z,2018-12-23T20:47:44Z,EPL,['Tottenham Hotspur']
514,p50nxv,City stunned as five-star United rediscover their EPL swagger,"Title contenders Manchester City and Chelsea both suffered shock losses, while Manchester United reminded fans of better days.",https://theage.com.au//sport/soccer/city-stunned-as-five-star-united-rediscover-their-epl-swagger-20181223-p50nxv.html,2018-12-22T20:25:24Z,2018-12-22T20:25:24Z,EPL,"['Manchester City', 'Manchester United', 'Liverpool FC', 'Chelsea FC']"
515,p50nwh,Liverpool seal Christmas top spot as Salah and Van Dijk sink Wolves,Manchester City can reduce the gap back to a point with a win over Crystal Palace at the Etihad Stadium on Saturday.,https://theage.com.au//sport/soccer/liverpool-seal-christmas-top-spot-as-salah-and-van-dijk-sink-wolves-20181222-p50nwh.html,2018-12-24T01:38:03Z,2018-12-22T12:18:11Z,EPL,['Liverpool FC']
516,p50nlt,Pochettino stopped from answering questions about United job,Tottenham manager Mauricio Pochettino has been stopped from answering questions on speculation linking him to the Manchester United job.,https://theage.com.au//sport/soccer/pochettino-stopped-from-answering-questions-about-united-job-20181221-p50nlt.html,2018-12-20T21:21:31Z,2018-12-20T21:21:31Z,EPL,"['Manchester United', 'Tottenham Hotspur']"
517,p50nbu,Sacked Mourinho says time at Manchester United already 'in the past',"There is plenty you can say about controversial, polarising manager Jose Mourinho, but one thing he sure doesn't do is dwell on the past.",https://theage.com.au//sport/soccer/sacked-mourinho-says-time-at-manchester-united-already-in-the-past-20181220-p50nbu.html,2018-12-20T03:49:52Z,2018-12-19T22:25:40Z,EPL,"['Manchester United', 'Chelsea FC']"
518,p50nb8,Solskjaer named as Jose Mourinho's replacement at Manchester United,Former Manchester United striker Ole Gunnar Solksjaer will take over the manager's chair vacated by Jose Mourinho until the end of the season.,https://theage.com.au//sport/soccer/solskjaer-named-as-jose-mourinho-s-replacement-at-manchester-united-20181219-p50nb8.html,2018-12-19T21:07:14Z,2018-12-19T09:52:34Z,EPL,['Manchester United']
519,p50n4u,Pogba panned following tweet after Mourinho sacking,"Darren Fletcher has strongly criticised Paul Pogba in the wake of Jose Mourinho's sacking as Manchester United manager, insisting the France star ""needs a kick up the backside"".",https://theage.com.au//sport/soccer/pogba-panned-following-tweet-after-mourinho-sacking-20181219-p50n4u.html,2018-12-18T23:37:47Z,2018-12-18T23:37:47Z,Manchester United,['EPL']
520,p50n3y,"Solskjaer, Phelan 'frontrunners' for United caretaker role","Former Manchester United striker Ole Gunnar Solskjaer and the club's ex-assistant coach Mike Phelan are set to return to Old Trafford as caretaker managers until the end of the season, a source close to the club says.",https://theage.com.au//sport/soccer/solskjaer-phelan-frontrunners-for-united-caretaker-role-20181219-p50n3y.html,2018-12-18T22:57:58Z,2018-12-18T22:57:58Z,Manchester United,['EPL']
521,p50n3p,Why Jose Mourinho could not be allowed to continue at Manchester United,Defensive football will never be a winner at Old Trafford. Something had to give and it finally did.,https://theage.com.au//sport/soccer/why-jose-mourinho-could-not-be-allowed-to-continue-at-manchester-united-20181219-p50n3p.html,2018-12-19T02:32:30Z,2018-12-18T22:00:00Z,EPL,"['Analysis', 'Manchester United']"
522,p50n2t,'The split seemed inevitable': Reactions and Mourinho's low points,"Former players have weighed in on Jose Mourinho's downward trajectory at Manchester United, where he spent a lot of money for little return.",https://theage.com.au//sport/soccer/the-split-seemed-inevitable-reactions-and-mourinho-s-low-points-20181218-p50n2t.html,2018-12-18T12:26:14Z,2018-12-18T12:08:08Z,Manchester United,['EPL']
523,p50n2q,Sacked: Manchester United show Jose Mourinho the door,"The club have announced the departure of Mourinho after their worst-ever start to a Premier League season, with Mauricio Pochettino favoured to replace him.",https://theage.com.au//sport/soccer/sacked-manchester-united-show-jose-mourinho-the-door-20181218-p50n2q.html,2018-12-18T12:16:53Z,2018-12-18T09:59:46Z,Manchester United,['EPL']
524,p50muv,Liverpool loss highlights problems facing the Manchester United brand,"They are still a money-making global behemoth, but how long will that continue as the Red Devils languish on the field?",https://theage.com.au//sport/soccer/liverpool-loss-highlights-problems-facing-the-manchester-united-brand-20181218-p50muv.html,2018-12-18T02:31:31Z,2018-12-18T02:31:31Z,EPL,"['Manchester United', 'Liverpool FC']"
525,p50mmq,Super-sub Shaqiri helps Liverpool sink United to reclaim EPL top spot,Liverpool remain the Premier League's only unbeaten team and added a little more pressure to Jose Mourinho with victory over fierce rivals Manchester United.,https://theage.com.au//sport/soccer/super-sub-shaqiri-helps-liverpool-sink-united-to-reclaim-epl-top-spot-20181217-p50mmq.html,2018-12-16T20:04:41Z,2018-12-16T19:38:47Z,EPL,"['Liverpool FC', 'Manchester United']"
526,p50mme,"Southampton end Arsenal's unbeaten run, Chelsea win at Brighton","Chelsea consolidated fourth place in the Premier League with a win at Brighton, while Southampton upset Arsenal.",https://theage.com.au//sport/soccer/southampton-end-arsenal-s-unbeaten-run-chelsea-win-at-brighton-20181217-p50mme.html,2018-12-16T15:55:54Z,2018-12-16T15:55:07Z,EPL,"['Chelsea FC', 'Arsenal FC']"
527,p50mj3,Pressure back on Liverpool as Man City knock off Everton,All eyes will be on Liverpool's clash with fierce rivals Manchester United after Pep Guardiola's side returned to the EPL summit.,https://theage.com.au//sport/soccer/pressure-back-on-liverpool-as-man-city-knock-off-everton-20181216-p50mj3.html,2018-12-15T21:22:36Z,2018-12-15T21:22:36Z,EPL,"['Manchester City', 'Liverpool FC', 'Manchester United']"
528,p50l7m,City's Sterling calls out media for coverage of black vs white players,"Himself reportedly the subject of racist abuse, Raheem Sterling has used social media to condemn the way the media reports on footballers of different ethnicities.",https://theage.com.au//sport/soccer/city-s-sterling-calls-out-media-for-coverage-of-black-vs-white-players-20181210-p50l7m.html,2018-12-10T10:28:38Z,2018-12-09T23:50:09Z,EPL,['Manchester City']
529,p50l7o,Benitez says VAR can't come soon enough after EPL loss,Both managers felt refereeing decisions played key roles after Wolverhampton scored a late winner against Newcastle United.,https://theage.com.au//sport/soccer/benitez-says-var-can-t-come-soon-enough-after-epl-loss-20181210-p50l7o.html,2018-12-09T21:26:47Z,2018-12-09T21:26:47Z,EPL,[]
530,p50l4j,Liverpool go top as Man City stumble at Chelsea,"Liverpool have hit top spot in the English Premier League with a 4-0 win at Bournemouth, while champions Manchester City lost their unbeaten league record in a 2-0 defeat at Chelsea.",https://theage.com.au//sport/soccer/liverpool-go-top-as-man-city-stumble-at-chelsea-20181209-p50l4j.html,2018-12-09T00:17:09Z,2018-12-09T00:10:25Z,EPL,[]
531,p50ki4,"Wolverhampton stun Chelsea, all square for Arsenal and United",Diogo Jota scored his first Premier League goal as Wolverhampton Wanderers came from behind to stun title hopefuls Chelsea 2-1 at Molineux on Wednesday.,https://theage.com.au//sport/soccer/massive-epl-upset-as-wolverhampton-stun-chelsea-20181206-p50ki4.html,2018-12-05T22:19:31Z,2018-12-05T22:02:13Z,EPL,[]
532,p50k9v,How Ranieri's Leicester love affair fizzled out,"They may have written the greatest fairytale in English soccer, but Claudio Ranieri's reunion with Leicester City is unlikely to be a love-in on Thursday morning [AEDT].",https://theage.com.au//sport/soccer/how-ranieri-s-leicester-love-affair-fizzled-out-20181205-p50k9v.html,2018-12-04T22:51:28Z,2018-12-05T00:00:00Z,EPL,[]
533,p50k9r,Manchester City now five points ahead of rivals after midweek EPL,Manchester City extended their lead at the top of the Premier League to five points with a 2-1 win at Watford thanks to the magic of Riyad Mahrez on Tuesday.,https://theage.com.au//sport/soccer/manchester-city-now-five-points-ahead-of-rivals-after-midweek-epl-20181205-p50k9r.html,2018-12-04T22:53:09Z,2018-12-04T22:53:09Z,EPL,['Manchester City']
534,p50k2l,Manchester City could face Champions League ban,Alleged financial deceptions uncovered in the Football Leaks scandal could lead Premier League leaders Manchester City to be banned from the Champions League.,https://theage.com.au//sport/soccer/manchester-city-could-face-champions-league-ban-20181204-p50k2l.html,2018-12-04T01:43:35Z,2018-12-04T01:43:35Z,EPL,['Manchester City']
535,p50jzy,Aubameyang abuse 'disaster' for the game: UEFA,UEFA boss Aleksander Ceferin says football needs to do more to combat racism after a banana skin was thrown at Arsenal striker Pierre-Emerick Aubameyang.,https://theage.com.au//sport/soccer/aubameyang-abuse-disaster-for-the-game-uefa-20181204-p50jzy.html,2018-12-03T21:18:33Z,2018-12-04T00:00:00Z,EPL,['Arsenal FC']
536,p50jrn,"Liverpool steal Everton win as Chelsea down Fulham, Arsenal sink Spurs",Goals from Pedro and Ruben Loftus-Cheek earned Chelsea a 2-0 Premier League win over Fulham on Sunday.,https://theage.com.au//sport/soccer/chelsea-in-convincing-premier-league-derby-win-over-fulham-20181203-p50jrn.html,2018-12-02T18:25:30Z,2018-12-02T15:57:20Z,EPL,['Chelsea FC']
537,p50jnc,Manchester United salvage draw at strugglers Southampton,"Manchester United have lost further ground to the Premier League leaders, needing to come from behind to secure a draw with lowly Southampton.",https://theage.com.au//sport/soccer/manchester-united-salvage-draw-at-strugglers-southampton-20181202-p50jnc.html,2018-12-01T20:46:55Z,2018-12-01T20:46:55Z,EPL,"['Manchester United', 'Manchester City', 'Liverpool FC']"
538,p50jae,"Liverpool, Arsenal shift focus to huge Premier League derbies",Two of the Premier League's biggest rivalry matches headline this weekend's round of fixtures.,https://theage.com.au//sport/soccer/liverpool-arsenal-shift-focus-to-huge-premier-league-derbies-20181130-p50jae.html,2018-11-29T23:25:52Z,2018-11-29T23:25:52Z,EPL,"['Liverpool FC', 'Arsenal FC', 'Tottenham Hotspur', 'Chelsea FC', 'Manchester City', 'Manchester United']"
539,p50inj,"Arsenal's Ukraine match to go ahead amid political tension, freezing temperatures",UEFA has said Arsenal's match with Vorskla Poltava will go ahead despite the president of Ukraine imposing martial law as tensions with Russia escalate.,https://theage.com.au//sport/soccer/arsenal-s-ukraine-match-to-go-ahead-amid-political-tension-freezing-temperatures-20181127-p50inj.html,2018-11-27T02:43:44Z,2018-11-27T02:43:44Z,Europa League,"['Arsenal FC', 'EPL', 'Ukraine']"
540,p50ijy,Newcastle win despite the miss of the Premier League season,Newcastle weren't made to pay for Matt Ritchie's embarrassing miss as Rafa Benitez's side held on to beat Burnley 2-1 for a third straight win in the EPL.,https://theage.com.au//sport/soccer/newcastle-win-despite-the-miss-of-the-premier-league-season-20181127-p50ijy.html,2018-11-26T23:40:10Z,2018-11-26T23:40:10Z,EPL,[]
541,p50ia5,Mooy brace gives Terriers a lift as Arsenal's unbeaten run continues,"Arsenal have extended their unbeaten run to 17 games in all competitions with a 2-1 victory at Bournemouth, while Socceroo Aaron Mooy starred for improving Huddersfield.",https://theage.com.au//sport/soccer/arsenal-continue-winning-ways-with-victory-at-bournemouth-20181126-p50ia5.html,2018-11-25T21:52:02Z,2018-11-25T16:40:51Z,EPL,['Arsenal FC']
542,p50i60,"Spurs end Chelsea's unbeaten run as Man City, Liverpool march on","Manchester City and Liverpool continued their winning ways, but Chelsea's undefeated Premier League streak was halted by their London rivals.",https://theage.com.au//sport/soccer/spurs-end-chelsea-s-unbeaten-run-as-man-city-liverpool-march-on-20181125-p50i60.html,2018-11-25T00:04:13Z,2018-11-24T21:40:31Z,EPL,"['Liverpool FC', 'Manchester City', 'Chelsea FC', 'Tottenham Hotspur']"
543,p50hsq,Ranieri's search for some of that old magic to save floundering Fulham,The man who orchestrated Leicester City's improbable Premier League triumph has another significant task ensuring Fulham's top-flight survival.,https://theage.com.au//sport/soccer/ranieri-s-search-for-some-of-that-old-magic-to-save-floundering-fulham-20181123-p50hsq.html,2018-11-23T01:05:04Z,2018-11-23T01:05:04Z,EPL,[]
544,p50gdo,EPL to introduce VAR as critics savage Scudamore payout,Officials have signed off on video assistant referees being introduced for the 2019-20 English Premier League season.,https://theage.com.au//sport/soccer/epl-to-introduce-var-as-critics-savage-scudamore-payout-20181116-p50gdo.html,2018-11-16T00:25:51Z,2018-11-16T00:21:44Z,EPL,[]
545,p50g8h,Chelsea among five EPL clubs being investigated by FIFA,Chelsea and four other Premier League clubs are facing the threat of being hit with a transfer ban as part of FIFA's investigation into the signing of foreign players under the age of 18.,https://theage.com.au//sport/soccer/chelsea-among-five-epl-clubs-being-investigated-by-fifa-20181115-p50g8h.html,2018-11-15T05:58:28Z,2018-11-15T03:02:51Z,EPL,['FIFA']
546,p50fxa,FA to cut foreign players in EPL - report,"In a bid to deal with Brexit and boost the number of homegrown players, the English FA is planning to reduce the number of overseas players in Premier League squads to 12 from 17.",https://theage.com.au//sport/soccer/fa-to-cut-foreign-players-in-epl-report-20181114-p50fxa.html,2018-11-14T00:39:20Z,2018-11-14T00:39:05Z,EPL,['Brexit']
547,p50fwo,Ground-breaker: Susanna Dinnage becomes Premier League CEO,A television executive with a track record of battling with Sky has been unveiled as the groundbreaking new chief executive of the Premier League.,https://theage.com.au//sport/soccer/ground-breaker-susanna-dinnage-becomes-premier-league-ceo-20181114-p50fwo.html,2018-11-13T23:56:17Z,2018-11-13T23:55:52Z,EPL,[]
548,p50fn3,Liverpool striker charged with breaching football betting rules,England and Liverpool striker Daniel Sturridge has until November 20 to answer a charge related to alleged breaches of football betting rules.,https://theage.com.au//sport/soccer/liverpool-striker-charged-with-breaching-football-betting-rules-20181113-p50fn3.html,2018-11-12T21:18:08Z,2018-11-12T21:18:08Z,EPL,['Liverpool FC']
549,p50ffh,"City win Manchester derby, but Liverpool closing in on champions",Premier League champions Manchester City stayed two points clear at the top on Sunday with a dominant 3-1 win in the derby against Manchester United.,https://theage.com.au//sport/soccer/city-win-manchester-derby-but-liverpool-closing-in-on-champions-20181112-p50ffh.html,2018-11-11T20:57:35Z,2018-11-11T20:56:22Z,EPL,['Manchester City']
550,p50fev,Goals to Salah and Shaqiri hand Liverpool victory over Fulham,Goals by Mo Salah and Xherdan Shaqiri gave Liverpool a 2-0 victory over bottom club Fulham at Anfield on Sunday.,https://theage.com.au//sport/soccer/goals-to-salah-and-shaqiri-hand-liverpool-victory-over-fulham-20181112-p50fev.html,2018-11-11T17:54:22Z,2018-11-11T14:22:14Z,EPL,['Liverpool FC']
551,p50fbf,"Leicester honour late owner as EPL battlers Cardiff, Newcastle win","There were some important results at the bottom of the EPL table, while Leicester City played their first home match since the death of their owner.",https://theage.com.au//sport/soccer/leicester-honour-late-owner-as-epl-battlers-cardiff-newcastle-win-20181111-p50fbf.html,2018-11-10T21:10:36Z,2018-11-10T21:10:36Z,EPL,['Tottenham Hotspur']
552,p50ey0,Mancini allegedly paid 'hidden' £1.75m in offshore account by Man City,"German magazine Der Spiegel has released more claims against Manchester City from leaked documents, this time related to former manager Roberto Mancini.",https://theage.com.au//sport/soccer/mancini-allegedly-paid-hidden-1-75m-in-offshore-account-by-man-city-20181109-p50ey0.html,2018-11-09T00:31:18Z,2018-11-09T00:31:18Z,EPL,['Manchester City']
553,p50eu6,Leicester players to wear special kits in tribute to late owner,Leicester City will wear shirts with their late club owner's name embroidered on them in their first home match since he was killed in a helicopter crash.,https://theage.com.au//sport/soccer/leicester-players-to-wear-special-kits-in-tribute-to-late-owner-20181108-p50eu6.html,2018-11-08T05:00:14Z,2018-11-08T05:00:14Z,EPL,[]
554,p50eqr,Man City 'ignored warnings' over controversial sponsorship deal,Whistle-blowers are claiming Manchester City pushed ahead with a $12.64 million-a-year sponsorship deal despite club staff expressing concerns about its morality.,https://theage.com.au//sport/soccer/man-city-ignored-warnings-over-controversial-sponsorship-deal-20181108-p50eqr.html,2018-11-08T00:56:44Z,2018-11-08T00:56:44Z,FIFA,"['EPL', 'Manchester City']"
555,p50ehj,European football calls for action as Man City accused of financial cheating,"The demands come in the wake of explosive allegations that the club systematically cheated the European governing body's Financial Fair Play (FFP) rules through a ""vast extent of deceit"".",https://theage.com.au//sport/european-football-calls-for-action-as-man-city-accused-of-financial-cheating-20181107-p50ehj.html,2018-11-07T00:04:49Z,2018-11-06T23:58:06Z,UEFA Champions League,['EPL']
556,p50efx,Manchester City financial maneuvering puts spotlight on money in world game,"No longer can you buy a pound of sausages from your club’s owners, but speculators, oligarchs and finally to whole countries will sell you a fantasy.",https://theage.com.au//sport/soccer/manchester-city-financial-maneuvering-puts-spotlight-on-money-in-world-game-20181107-p50efx.html,2018-11-06T22:14:52Z,2018-11-06T22:14:52Z,EPL,[]
557,p50e95,Mooy's Huddersfield break EPL duck,Timothy Fosu-Mensah's first-half own goal has given Huddersfield a 1-0 home win against Fulham and their first Premier League victory of the season.,https://theage.com.au//sport/soccer/mooy-s-huddersfield-break-epl-duck-20181106-p50e95.html,2018-11-06T00:39:13Z,2018-11-06T00:13:21Z,EPL,[]
558,p50dza,Leicester City keeper speaks of trauma after witnessing chopper crash,Kasper Schmeichel had to be held back by police after watching the helicopter crash that killed Leicester City owner Vichai Srivaddhanaprabha and four other people.,https://theage.com.au//sport/soccer/leicester-city-keeper-speaks-of-trauma-after-witnessing-chopper-crash-20181105-p50dza.html,2018-11-05T02:15:26Z,2018-11-05T00:01:00Z,EPL,[]
559,p50dyy,"Sterling scores twice as Manchester City hit Southampton for six, Chelsea beat Palace",Raheem Sterling struck twice as Premier League leaders Manchester City crushed Southampton 6-1 at the Etihad Stadium on Sunday.,https://theage.com.au//sport/soccer/sterling-strikes-twice-as-manchester-city-hit-southampton-for-six-20181105-p50dyy.html,2018-11-04T19:17:43Z,2018-11-04T17:27:34Z,EPL,['Manchester City']
560,p50dv4,Emotions high as Leicester City triumph on testing Premier League day,"Leicester City were able to give their fans some cheer on a tough night in Cardiff, while Liverpool and Arsenal fought out an entertaining draw.",https://theage.com.au//sport/soccer/emotions-high-as-gray-seals-leicester-win-on-testing-day-20181104-p50dv4.html,2018-11-03T23:02:13Z,2018-11-03T20:19:53Z,EPL,"['Liverpool FC', 'Arsenal FC', 'Manchester United']"
561,p50diu,'Numb' Leicester preparing to play again following owner's death,"After one of the most horrific weeks in club history, Leicester City will return to the field to face Cardiff City this weekend.",https://theage.com.au//sport/soccer/numb-leicester-preparing-to-play-again-following-owner-s-death-20181102-p50diu.html,2018-11-02T01:11:28Z,2018-11-02T01:11:28Z,EPL,[]
562,p50dj9,Sterling set to sign lucrative Manchester City deal extension,England forward Raheem Sterling has verbally agreed a new five-year deal with English Premier League champions Manchester City.,https://theage.com.au//sport/soccer/sterling-set-to-sign-lucrative-manchester-city-deal-extension-20181102-p50dj9.html,2018-11-01T21:17:01Z,2018-11-01T21:17:01Z,EPL,[]
563,p50da8,Chelsea beat Lampard's Derby to reach League Cup quarters,"It was a good day for London clubs as Chelsea, Arsenal and Tottenham all reached the League Cup quarter-finals.",https://theage.com.au//sport/soccer/chelsea-beat-lampard-s-derby-to-reach-league-cup-quarters-20181101-p50da8.html,2018-10-31T22:37:30Z,2018-10-31T22:37:30Z,EPL,"['Chelsea FC', 'Arsenal FC', 'Manchester City']"
564,p50d9n,Leicester owner's son vows to carry on his legacy,Leicester City vice-chairman Aiyawatt Srivaddhanaprabha has paid an emotional tribute to his father Vichai and vowed to carry on his legacy.,https://theage.com.au//sport/soccer/leicester-owner-s-son-vows-to-carry-on-his-legacy-20181101-p50d9n.html,2018-10-31T21:22:18Z,2018-10-31T21:22:18Z,EPL,[]
565,p50ct4,Mahrez dedicates winner to Leicester owner as City return to top,Manchester City returned to the top of the Premier League following a lone strike from ex-Leicester City star Riyad Mahrez.,https://theage.com.au//sport/soccer/mahrez-dedicates-winner-to-leicester-owner-as-city-return-to-top-20181030-p50ct4.html,2018-10-30T00:26:16Z,2018-10-29T23:37:14Z,EPL,['Manchester City']
566,p50crt,Leicester City owner’s son visits stadium as black box is recovered,"Vichai Srivaddhanaprabha's son, current and former players and Prince William are among those who have paid their respects following the death of the Leicester City owner.",https://theage.com.au//sport/soccer/leicester-city-owner-s-son-visits-stadium-as-black-box-is-recovered-20181030-p50crt.html,2018-10-29T20:35:36Z,2018-10-29T20:35:13Z,EPL,[]
567,p50clp,Leicester City players devastated by owner's death,"A number of Leicester City players, including Jamie Vardy, Harry Maguire and Kasper Schmeichel, have reacted to the death of the club's owner.",https://theage.com.au//sport/soccer/outpouring-leicester-players-devastated-by-owner-s-death-20181029-p50clp.html,2018-10-29T05:30:05Z,2018-10-29T00:40:30Z,EPL,[]
568,p50cjl,Hoddle remains in a 'serious condition' but responding to treatment,"Glenn Hoddle suffered a heart attack on the weekend, but the former England player and manager is responding to treatment in hospital.",https://theage.com.au//sport/soccer/hoddle-remains-in-a-serious-condition-but-responding-to-treatment-20181029-p50cjl.html,2018-10-28T23:50:02Z,2018-10-28T23:50:02Z,EPL,"['England', 'Tottenham Hotspur']"
